{"$schema":"../schemas/evidence_manifest.schema.json","limitations":["This is a pre-market daily refresh using the latest completed regular session (September 3); September 4 intraday data is intentionally excluded.","The prior September 3 snapshot was a legacy import without archived Pass 1-4/6 numeric worksheets. This run executes all six verification passes but does not invent missing historical pass scores.","Pass 2 retains the prior reconstructed financial thesis and rechecks the latest reported results; the full eight-quarter worksheet is not re-archived in this daily snapshot.","Weekly Technical Score uses the newly explicit v2.2 formula, so its delta versus the legacy score is a methodology transition as well as a market-data change.","A complete daily ETF-holdings constituent diff is not archived; no material major-index membership change was identified pre-market."],"run_date":"2026-09-04","schema_version":"1.0.0","snapshot_revision":1,"sources":[{"content_sha256":null,"locator":"stock-project-v2/data/multi_bagger/evidence/2026-09-04-market.json","notes":"20/20 tickers: Sep 3 close, market cap, 20/50/200DMA, RSI, MACD, ADX, volume, relative strength vs QQQ/SMH, 52-week range and v2.2 technical components.","retrieved_at":"2026-09-04T12:06:37Z","source_date":"2026-09-03","source_id":"market-technical-2026-09-04","source_type":"market_data","title":"September 4 Multi Bagger market and technical evidence"},{"content_sha256":null,"locator":"SEC EDGAR and issuer investor-relations sites","notes":"Daily filing/IR inventory reconciled against the September 3 snapshot; no new financial statement or guidance reset was found that required a fundamental score-band change.","retrieved_at":"2026-09-04T12:13:49Z","source_date":"2026-09-04","source_id":"sec-ir-delta-scan-2026-09-04","source_type":"primary_source_inventory","title":"SEC EDGAR and issuer-IR daily delta scan — Multi Bagger Top-20"},{"content_sha256":null,"locator":"S&P DJI, FTSE Russell/LSEG and current sector news","notes":"AI infrastructure demand remains strong but power/capital constraints persist; Russell U.S. reconstitution is later in 2026; no pre-market major membership change identified.","retrieved_at":"2026-09-04T12:13:49Z","source_date":"2026-09-04","source_id":"sector-index-2026-09-04","source_type":"sector_index_review","title":"AI infrastructure, software/space sector and major U.S. index calendar review"},{"content_sha256":null,"locator":"https://investors.rocketlabcorp.com/news-releases/news-release-details/mission-success-rocket-lab-launches-94th-electron-mission","notes":"Synspective StriX successfully deployed; 16 further Synspective Electron missions booked.","retrieved_at":"2026-09-04T12:13:49Z","source_date":"2026-09-02","source_id":"rklb-mission-2026-09-02","source_type":"issuer_ir","title":"Rocket Lab: Mission Success — 94th Electron Mission"},{"content_sha256":null,"locator":"https://ir.amprius.com/","notes":"Latest IR inventory includes SiCore 500 introduction and Q2 2026 financial results.","retrieved_at":"2026-09-04T12:13:49Z","source_date":"2026-09-02","source_id":"ampx-ir-2026-09-04","source_type":"issuer_ir","title":"Amprius Technologies Investor Relations"},{"content_sha256":null,"locator":"https://ir.applieddigital.com/","notes":"Latest annual/financial disclosure inventory rechecked; no new Sep 3 guidance update.","retrieved_at":"2026-09-04T12:13:49Z","source_date":"2026-09-04","source_id":"apld-ir-2026-09-04","source_type":"issuer_ir","title":"Applied Digital Investor Relations"},{"content_sha256":null,"locator":"https://investors.figure.com/","notes":"Kiavi acquisition closed Sep 1; Sep 3 update was upcoming investor-conference participation with no new guidance.","retrieved_at":"2026-09-04T12:13:49Z","source_date":"2026-09-03","source_id":"figr-ir-2026-09-04","source_type":"issuer_ir","title":"Figure Technology Solutions Investor Relations"},{"content_sha256":null,"locator":"https://nebius.com/newsroom/nebius-to-participate-in-upcoming-investor-conferences","notes":"No new financial guidance in the Sep 2 conference notice.","retrieved_at":"2026-09-04T12:13:49Z","source_date":"2026-09-02","source_id":"nbis-ir-2026-09-02","source_type":"issuer_ir","title":"Nebius: upcoming investor conferences"},{"content_sha256":null,"locator":"https://investors.terawulf.com/news-events/press-releases/detail/144/terawulf-reports-second-quarter-2026-results","notes":"102 MW revenue-generating critical IT capacity, 336 MW under construction, ~$19B Anthropic lease and substantial liquidity.","retrieved_at":"2026-09-04T12:13:49Z","source_date":"2026-08-05","source_id":"wulf-q2-2026","source_type":"issuer_ir","title":"TeraWulf Reports Second Quarter 2026 Results"},{"content_sha256":null,"locator":"https://investors.zetaglobal.com/news/news-details/2026/Zeta-Global-Reports-20th-Consecutive-Beat-and-Raise-Quarter-Achieves-the-Rule-of-64-and-Generates-Positive-GAAP-Net-Income-in-2Q26/default.aspx","notes":"44% revenue growth, positive GAAP net income, guidance raised.","retrieved_at":"2026-09-04T12:13:49Z","source_date":"2026-08-04","source_id":"zeta-q2-2026","source_type":"issuer_ir","title":"Zeta Global Reports Second Quarter 2026 Results"},{"content_sha256":null,"locator":"https://ir.tssiusa.com/","notes":"Latest posted financial release remains Q2 2026 (Aug 13); no Sep 3 material update.","retrieved_at":"2026-09-04T12:13:49Z","source_date":"2026-08-17","source_id":"tssi-ir-2026-09-04","source_type":"issuer_ir","title":"TSS Investor Relations"},{"content_sha256":null,"locator":"https://www.sec.gov/Archives/edgar/data/1920294/000119312526378541/0001193125-26-378541-index.htm","notes":"H1 filing verified; revenue $130.8M was already reflected in the prior run thesis context.","retrieved_at":"2026-09-04T12:13:49Z","source_date":"2026-09-01","source_id":"rzlv-h1-2026","source_type":"sec_filing","title":"Rezolve AI H1 2026 Form 6-K"},{"content_sha256":null,"locator":"https://www.cormedix.com/","notes":"Conference participation only; no financial guidance change.","retrieved_at":"2026-09-04T12:13:49Z","source_date":"2026-09-01","source_id":"crmd-conference-2026-09-01","source_type":"issuer_news","title":"CorMedix Wells Fargo Healthcare Conference participation"},{"content_sha256":null,"locator":"https://ir.richtechrobotics.com/node/7606/html","notes":"Liquidity and balance-sheet progress rechecked; early-stage operating execution remains the key risk.","retrieved_at":"2026-09-04T12:13:49Z","source_date":"2026-08-01","source_id":"rr-sec-q3fy26","source_type":"sec_filing","title":"Richtech Robotics latest fiscal 2026 filing"},{"content_sha256":null,"locator":"https://investors.gorilla-technology.com/gorilla-technology-reports-for-full-year-2025-record-revenue-of-101-4-million-and-major-profitability-turnaround/","notes":"Record FY2025 revenue and profitability improvement; large AI infrastructure pipeline with execution/cash-conversion risk.","retrieved_at":"2026-09-04T12:13:49Z","source_date":"2026-03-02","source_id":"grrr-fy2025","source_type":"issuer_ir","title":"Gorilla Technology FY2025 results and 2026 outlook"},{"content_sha256":null,"locator":"https://investors.axt.com/Investors/news/news-details/2026/AXT-Inc--Announces-Second-Quarter-2026-Financial-Results/default.aspx","notes":"Revenue $47.6M, gross margin 44.9%, record InP revenue; export-permit and China exposure remain risks.","retrieved_at":"2026-09-04T12:13:49Z","source_date":"2026-07-30","source_id":"axt-q2-2026","source_type":"issuer_ir","title":"AXT Q2 2026 financial results"},{"content_sha256":null,"locator":"https://ir.liveperson.com/","notes":"Shareholder approval reduces closing risk; transaction expected to close Sep 4 subject to customary conditions.","retrieved_at":"2026-09-04T12:13:49Z","source_date":"2026-09-02","source_id":"soun-liveperson-approval","source_type":"transaction_update","title":"LivePerson shareholders approve SoundHound AI transaction"},{"content_sha256":null,"locator":"https://www.poet-technologies.com/","notes":"Revenue growth and optical-interposer commercialization rechecked; early revenue scale remains a caveat.","retrieved_at":"2026-09-04T12:13:49Z","source_date":"2026-08-13","source_id":"poet-q2-2026","source_type":"issuer_results","title":"POET Technologies Q2 2026 results"},{"content_sha256":null,"locator":"https://investors.serverobotics.com/","notes":"Deployment scale and Diligent Robotics expansion rechecked; cash burn and integration remain risks.","retrieved_at":"2026-09-04T12:13:49Z","source_date":"2026-08-06","source_id":"serv-q2-2026","source_type":"issuer_results","title":"Serve Robotics Q2 2026 results"}]}
