{"$schema":"../schemas/evidence_manifest.schema.json","limitations":["The legacy dashboard did not contain source-level Pass 1-6 evidence manifests.","The source file hash verifies the imported dashboard artifact, not the underlying SEC, IR, market-data, or technical-data sources."],"run_date":"2026-09-03","schema_version":"1.0.0","snapshot_revision":1,"sources":[{"content_sha256":"7c2df74b03cab665a6874c4d23784091e6410afecd2f4cb248c779179531957d","locator":"ChatGPT Library","notes":"Source used to migrate the available September 3 ranks, top-level scores, technical scores, actions, confidence labels, entry zones, and thesis/correction notes.","retrieved_at":"2026-09-03T13:10:15Z","source_date":"2026-09-03","source_id":"legacy-dashboard-history-2026-09-03","source_type":"legacy_dashboard_history","title":"Multi_Bagger_Dashboard_History.md"}]}
